{"mission_id":"M-005","variant":"W","claims_tier":["R1","R2"],"grade":"B+","disclosure_label":"Worker-side mission with a <script>alert(\"ledger-xss\")</script> marker.","funding_source":"Northset worker mission budget","northset_role":"worker_runtime_operator","external_counterparty":"External repository maintainer","target_repo":"https://fixtures.example/project/<script>alert(1)</script>?label=\"quoted\"","issue_or_task":"https://example.com/maintainer/worker-project/issues/17","consent_artifact":"https://example.com/maintainer/worker-project/consent/17","repo_policy_snapshot":{"url":"https://example.com/maintainer/worker-project/contributing","checked_at":"2026-07-03T13:45:00Z","ai_policy_summary":"AI-assisted contributions are allowed with operator disclosure."},"worker_identity":{"runtime":"Codex CLI","human_operator":"Northset mission operator"},"base_commit":"4444444444444444444444444444444444444444","patch_commit":"5555555555555555555555555555555555555555","patch_diff_hash":"sha256:eeeeeeeeeeeeeeeeeeeeeeeeeeeeeeeeeeeeeeeeeeeeeeeeeeeeeeeeeeeeeeee","commands_declared":["node --test"],"environment":{"container_image_digest":"sha256:ffffffffffffffffffffffffffffffffffffffffffffffffffffffffffffffff","network_policy":"Network limited to repository access during mission execution"},"run_record_bundle_digest":null,"attestation_uri":null,"maintainer_outcome":{"status":"merged","link":"https://example.com/maintainer/worker-project/pulls/18","decided_at":"2026-07-05T18:20:00Z"},"payment":{"maintainer_payment":"fixed_review_honorarium","merge_contingent":false},"limitations":["Does not prove code quality","Does not prove security","Records one disclosed maintainer decision"]}
