{
  "mission_id": "M-001",
  "variant": "own_repo_rehearsal",
  "claims_tier": [
    "R0"
  ],
  "grade": "B0",
  "disclosure_label": "Self-funded rehearsal. Not external validation.",
  "funding_source": "Northset OSS Fund",
  "northset_role": "both_sides_disclosed",
  "external_counterparty": null,
  "target_repo": "https://github.com/northset-oss/verification-pilot",
  "issue_or_task": null,
  "consent_artifact": null,
  "repo_policy_snapshot": null,
  "worker_identity": {
    "runtime": "northset-oss executor v0",
    "human_operator": "aeziz"
  },
  "base_commit": null,
  "patch_commit": null,
  "patch_diff_hash": null,
  "commands_declared": [
    "node --test"
  ],
  "environment": null,
  "run_record_bundle_digest": null,
  "attestation_uri": null,
  "maintainer_outcome": {
    "status": "pending",
    "link": null,
    "decided_at": null
  },
  "payment": {
    "maintainer_payment": "none",
    "merge_contingent": false
  },
  "limitations": [
    "Does not prove code quality",
    "Does not prove security",
    "Self-funded rehearsal on Northset's own repository; not external validation."
  ]
}
